{
  "type": "Catalog",
  "stac_version": "1.1.0",
  "id": "portolan-registry",
  "title": "Portolan Registry",
  "description": "A unified registry of Portolan catalogs. Each child link points to a registered cloud-native STAC catalog.",
  "generated": "2026-01-15T12:00:00+00:00",
  "count": 1,
  "links": [
    {
      "rel": "root",
      "href": "https://raw.githubusercontent.com/portolan-sdi/portolan-registry/refs/heads/main/exports/catalogs.json",
      "type": "application/json",
      "title": "Portolan Registry"
    },
    {
      "rel": "self",
      "href": "https://raw.githubusercontent.com/portolan-sdi/portolan-registry/refs/heads/main/exports/catalogs.json",
      "type": "application/json"
    },
    {
      "rel": "child",
      "href": "https://ex.org/catalog.json",
      "type": "application/json",
      "title": "Example Catalog",
      "bbox": [
        -1.0,
        48.0,
        7.0,
        55.0
      ],
      "portolan_registry:id": "example",
      "portolan_registry:status": "valid",
      "portolan_registry:api_type": "static",
      "portolan_registry:spec_version": "0.1.0",
      "portolan_registry:spec_version_mixed": false,
      "portolan_registry:stac_version": "1.1.0",
      "portolan_registry:logo": {
        "href": "https://ex.org/_assets/logo.png",
        "type": "image/png",
        "title": "Example"
      },
      "portolan_registry:updated": "2026-01-10T08:30:00Z",
      "portolan_registry:first_registered": null,
      "portolan_registry:kind": "mirror",
      "portolan_registry:producers": [
        {
          "name": "Coastal Authority",
          "url": "https://coastal.example/"
        },
        {
          "name": "Inland Agency",
          "url": "https://inland.example/"
        }
      ],
      "portolan_registry:processors": [
        {
          "name": "Example Converter",
          "url": "https://converter.example/"
        }
      ],
      "portolan_registry:host": {
        "name": "Example Host",
        "url": "https://host.example/"
      },
      "portolan_registry:licenses": {
        "CC-BY-4.0": 2,
        "ODbL-1.0": 1
      },
      "portolan_registry:collection_count": 3,
      "portolan_registry:feature_count": 1500,
      "portolan_registry:item_count": 5,
      "portolan_registry:asset_count": 3,
      "portolan_registry:total_size_bytes": 6144,
      "portolan_registry:counts_partial": false,
      "portolan_registry:last_crawled": "2026-01-15T12:00:00+00:00",
      "portolan_registry:last_validated": "2026-01-15T12:00:00+00:00",
      "portolan_registry:stale_since": null,
      "portolan_registry:failure_reason": null,
      "portolan_registry:stac_valid": null,
      "portolan_registry:has_agents_md": true,
      "portolan_registry:has_readme": true,
      "portolan_registry:deprecated": false,
      "portolan_registry:deprecated_since": null,
      "portolan_registry:deprecated_reason": null,
      "portolan_registry:superseded_by": null
    }
  ]
}
